,artist,song,link,lyrics,genre
0,The Who,Baba O'Riley,http://genius.com/The-who-baba-oriley-lyrics,"{Lead In}

{Roger Daltrey}
Out here in the fields, I fight for my meals
I get my back into my living
I don't need to fight to prove I'm right
I don't need to be forgiven

{Pete Townshend}
Don't cry, don't raise your eye
It's only teenage wasteland

{Roger Daltrey}
Sally, take my hand, we'll travel south 'cross land
Put out the fire and don't look past my shoulder
The exodus is here,the happy ones are near
Let's get togetherbefore we get much older

{Roger Daltrey}
Teenage wasteland,it's only teenage wasteland
Teenage wasteland, oh, oh
Teenage wasteland,they're all wasted!

{Instrumental}",rock
1,The Who,Won't Get Fooled Again,http://genius.com/The-who-wont-get-fooled-again-lyrics,"We'll be fighting in the streets
With our children at our feet
And the morals that they worship will be gone
And the men who spurred us on
Sit in judgment of all wrong
They decide and the shotgun sings the song

I'll tip my hat to the new constitution
Take a bow for the new revolution
Smile and grin at the change all around me
Pick up my guitar and play
Just like yesterday
And I'll get on my knees and pray
We don't get fooled again
Don't get fooled again

Change it had to come
We knew it all along
We were liberated from the fold that's all
But the world looks just the same
And history ain't changed
Cause the banners, they all flown in the last war

I'll tip my hat to the new constitution
Take a bow for the new revolution
Smile and grin at the change all around me
Pick up my guitar and play
Just like yesterday
And I'll get on my knees and pray
We don't get fooled again
No, no!

I'll move myself and my family aside
If we happen to be left half alive
I'll get all my papers and smile at the sky
For I know that the hypnotized never lie

Do ya?

There's nothing in the street
Looks any different to me
And the slogans are replaced, by-the-bye
And the parting on the left
Is now the parting on the right
And the beards have all grown longer overnight

I'll tip my hat to the new constitution
Take a bow for the new revolution
Smile and grin at the change all around me
Pick up my guitar and play
Just like yesterday
Then I'll get on my knees and pray
We don't get fooled again
Don't get fooled again
No, no!

YEAH!!!

Meet the new boss
Same as the old boss",rock
2,The Who,Behind Blue Eyes,http://genius.com/The-who-behind-blue-eyes-lyrics,"No one knows what it's like
To be the bad man, to be the sad man
Behind blue eyes

No one knows what it's like
To be hated, to be fated
To telling only lies

But my dreams, they aren't as empty
As my conscience seems to be
I have hours, only lonely
My love is vengeance that's never free

No one knows what it's like
To feel these feelings like I do
And I blame you

No one bites back as hard
On their anger, none of my pain and woe
Can show through

But my dreams, they aren't as empty
As my conscience seems to be
I have hours, only lonely
My love is vengeance that's never free

When my fist clenches, crack it open
Before I use it and lose my cool
When I smile, tell me some bad news
Before I laugh and act like a fool

And if I swallow anything evil
Put your finger down my throat
And if I shiver, please give me a blanket
Keep me warm, let me wear your coat

No one knows what it's like
To be the bad man, to be the sad man
Behind blue eyes",rock
3,The Who,Who Are You,http://genius.com/The-who-who-are-you-lyrics,"I woke up in a Soho doorway
A policeman knew my name
He said ""You can go sleep at home tonight
If you can get up and walk away""
I staggered back to the underground
And the breeze blew back my hair
I remember throwing punches around
And preaching from my chair


Well, who are you? (Who are you? Who, who, who, who?)
I really want to know (Who are you? Who, who, who, who?)
Because I really want to know (Who are you? Who, who, who, who?)


I took the tube back out of town
Back to the Rolling Pin
I felt a little like a dying clown
With a streak of Rin
I stretched back and I hiccupped
And looked back on my busy day
Eleven hours in the Tin Pan
God, there's got to be another way
Who are you?
Oh wa oh wa oh wa oh wa






I know there's a place you walked
Where love falls from the trees
My heart is like a broken cup
I only feel right on my knees
I spit out like a sewer hole
Yet still receive your kiss
How can I measure up to anyone now
After such a love as this?

",rock
4,The Who,Eminence Front,http://genius.com/The-who-eminence-front-lyrics,"The sun shines
And people forget
The spray flies as the speedboat glides
And people forget
Forget they are hiding
The girls smile
And people forget
The snow packs as the skier tracks
And people forget
Forget they are hiding


Behind an eminence front
Eminence front – It is a put on
Come on join the party
Dress to kill
Will not you come and join the party
Dress to kill


The drinks flow
People forget
That big wheel spins, the hair thins
People forget
Forget they are hiding
The news slows
People forget
The shares crash, hopes are dashed
People forget
Forget they are hiding


Behind an eminence front
Eminence front – it is a put on
Come on join the party
Dress to
Come on join the party
Dress to
Come on join the party
Dress to
Come on join the party
Dress to kill
Dress yourself, dressed to kill",rock
5,The Who,My Generation prod. by Shel Talmy,http://genius.com/The-who-my-generation-lyrics,"d-down(Talking aboutmy generation)
Just because we get around(Talking about my generation)
Things they do look awful c-c-cold (Talking about my generation)
I hope I die before I get old(Talking about my generation)

This is my generation
This is my generation, baby


Why don't you all f-fade away (Talkin' 'bout my generation)
And don't try to dig what we all s-s-say(Talkin' 'bout my generation)
I'm not trying to cause a big s-s-sensation (Talkin' 'bout my generation)
I'm just talkin' 'bout my g-g-g-generation (Talkin' 'bout my generation)

This is my generation
This is my generation, baby





Why don't you all f-fade away (Talkin' 'bout my generation)
And don't try to dig what we all s-s-say (Talkin' 'bout my generation)
I'm not trying to cause a big s-s-sensation (Talkin' 'bout my generation)
I'm just talkin' 'bout my g-g-g-generation (Talkin' 'bout my generation)

This is my generation
This is my generation, baby


People try to put us d-down (Talking about my generation
Just because we get around (Talking about my generation)
Things they do look awful c-c-cold (Talking about my generation)
I hope I die before I get old(Talking about my generation)

This is my generation
This is my generation, baby

{Outro}",rock
6,The Who,Pinball Wizard prod. by Kit Lambert,http://genius.com/The-who-pinball-wizard-lyrics,"Ever since I was a young boy
I've played the silver ball
From Soho down to Brighton
I must have played them all
But I ain't seen nothing like him
In any amusement hall
That deaf, dumb, and blind kid
Sure plays a mean pinball

He stands like a statue
Becomes part of the machine
Feeling all the bumpers
Always playing clean
Plays by intuition
The digit counters fall
Thatdeaf, dumb, and blind kid
Sure plays a mean pinball

He's a pinball wizard
There has to be a twist
A pinball wizard's
Got such a supple wrist

How do you think he does it?
I don't know!
What makes him so good?

Ain't got no distractions
Can't hear no buzzers and bells
Don't see no lights a flashin'
Plays by sense of smell
Always gets the replay
Never seen him fall
Thatdeaf, dumb, and blind kid
Sure plays a mean pinball

I thought I was
The Bally table king
But I just handed
My pinball crown to him

Even on my favorite table
He can beat my best
His disciples lead him in
And he just does the rest
He's got crazy flipper fingers
Never seen him fall
That deaf, dumb, and blind
Sure plays a mean pinball!",rock
7,The Who,1921 prod. by Kit Lambert,http://genius.com/The-who-1921-lyrics,"Got a feeling '21
Is going to be a good year
Especially if you and me
See it in together

So you think '21
Is going to be a good year?
It could be good for me and her
But you and her, no, never!
I had no reason to be over optimistic
But somehow, when you smiled
I could brave bad weather

What about the boy?
What about the boy?
What about the boy?
He saw it all!

You didn't hear it
(I heard it)
You didn't see it
(I saw it)
You won't say nothing to no one
(I won't say nothing to no one)
Never in your life
(never in my life)
You never heard it
(I heard it)
How absurd it all seems
Without any proof
(How absurd it all seems without any proof)
You didn't hear it
(I heard it)
You didn't see it
(I saw it)
You never heard it, not a word of it!
(I heard it, every word of it)
You won't say nothing to no one
(I won't say nothing to no one)
Never tell a soul
What you know is the truth
(Never tell a soul
What I know is the truth)

Got a feeling '21
Is going to be a good year
Especially if you and me
See it in together
Got a feeling '21
Is going to be a good year
Especially if you and me
See it in together
I had no reason to be over-optimistic
But somehow, when you smiled
I could brave bad weather

What about the boy?",rock
8,The Who,5:15 prod. by Kit Lambert,http://genius.com/The-who-5-15-lyrics,"The ushers are sniffing
Eau de Cologning
The seats are seductive
Celibate sitting
Pretty girls digging
Prettier women

Magically bored on a quiet street corner
Free frustration in our minds and our toes
Quiet storm water,m-m-my generation
Uppers and downers, either way blood flows


Inside outside
Leave me alone
Inside outside
Nowhere is home
Inside outside
Where have I been?
Out of my brain on the 5:15
Out of my brain on the train
Out of my brain on the train


On a raft in the quarry
Slowly sinking
Back of alorry
Holy hitching
Dreadfully sorry
Apple scrumping
Born in the war
Birthday punching

He man drag in a glittering ballroom
Greyly outrageous in my high heel shoes
Tightly undone, know what they're showing
Sadly ecstatic that their heros are news




Why should I care?
Why should I care?",rock
9,The Who,905,http://genius.com/The-who-905-lyrics,"Mother was an incubator
Father was the contents
Of atest tubein the ice box
In the factory of birth
My name is 905
And I've just become alive
I'm the newest populator
Of the planet we call Earth


In suspended animation
My childhood passed me by
If I speak without emotion
Then you know the reason why
Knowledge of the universe
Was fed into my mind
As my adolescent body
Left its puberty behind


And everything I know is what I need to know
And everything I do's been done before
Every sentence in my head
Someone else has said
At each end of my life is an open door


Automatically defrosted
When manhood came on time
I became a man
I left the""ice school""behind
Now I'm to begin
The life that I'm assigned
A life that's been used before
A thousand times


I have a feeling deep inside
That somethin' is missing
It's a feeling in my soul
And I can't help wishing
That one day I'll discover
That we're living a lie
And I'll tell the whole world
The reason why

",rock
10,The Who,Amazing Journey,http://genius.com/The-who-amazing-journey-lyrics,"Deaf, dumb and blind boy
He's in a quiet vibration land
Strange as it seems
His musical dreams
Ain't quite so bad

Ten years old
With thoughts as bold
As thought can be
Loving life and becoming wise
In simplicity


Sickness can surely take the mind
Where minds can't usually go
Come on the amazing journey
And learn all you should know


A vague haze of delirium
Creeps up on me
All at once a tall stranger
I suddenly see
He's dressed in a silver-sparked
Glittering gown
And his golden beard flows
Nearly down to the ground

Nothing to say, and nothing to hear
And nothing to see
Each sensation makes a note
In my symphony




His eyes are the eyes
That transmit all they know
Sparkle warm crystalline glances to show
That he is your leader
And he is your guide
On the amazing journey together you'll ride",rock
11,The Who,A Quick One While He's Away,http://genius.com/The-who-a-quick-one-while-hes-away-lyrics,"Her man's been gone
For nigh on year
He was due home yesterday
But he ain't here


Down your street your crying is a well-known sound
Your street is very well known, through out your town
Your town is very famous for the little girl
Whose crying can be heard all around the world
Oh


We have a remedy
You'll appreciate
No need to feel so bad
He's only late
We'll bring you flowers and things
Help pass your time
We'll give him eagle's wings
Then he can fly to you


Fa la la la la la
Fa la la la la
Fa la la la la la
Fa la la la la
Fa la la la la la
Fa la la la la la

We have a remedy
Fa la la la la la la
We have a remedy
Fa la la la la la la
We have a remedy
Fa la la la la la la
We have a remedy
Fa la la la la la la


We have a remedy
We have!
Little girl guide, why don't you stop your crying?
Here comes Ivor the engine driver to make you feel much better


My name is Ivor
I'm an engine driver
I know him well
I know why you feel blue
Just cause he's late
Don't mean he'll never get through
He told me he loves you
He ain't no liar, I ain't either
So let's have a smile for an old engine driver
Let's have a smile for an old engine driver


Soon be home [x2]
We'll soon
We'll soon, soon, soon be home
We'll soon be home
Soon be home
We'll soon
We'll soon, soon, soon be home

Come on, old horse


Soon be home [x2]
Soon
We'll soon, soon, soon be home


Dang, dang, dang, dang, dang, dang, dang, dang, dang
Cello cello cello cello cello cello cello cello
I can't believe it
Do my eyes deceive me?
Am I back in your arms?
Away from all harm?


It's like a dream to be with you again
Can't believe that I'm with you again
I missed you and I must admit
I kissed a few and once did sit
On Ivor the Engine Driver's lap
And later with him, had a nap
You are forgiven, you are forgiven, you are forgiven




You are forgiven",rock
12,The Who,Athena,http://genius.com/The-who-athena-lyrics,"Athena, I had no idea how much I would need her
In peaceful times I hold her close and I feed her
My heart starts palpitating when I think my guess was wrong
But I think I will get along
She's just a girl – she's a bomb
Athena, all I ever want to do is please her
My life has been so settled and she is the reason
Just one word from her and my troubles are long gone
But I think I'll  get along
She's just a girl – she's a bomb


Just a girl just a girl[x3]
She's just a girl


Athena, my heart felt like a shattered glass in an acid bath
I felt like one of those flattened ants you find on a crazy path
I would of topped myself to give her time she did not need to ask
Was I a suicidal psychopath?
She's just a girl – she's a bomb
Consumed, there was a beautiful white horse I saw on a dream stage
He had a snake the size of a sewer pipe living in his rib cage
I felt like a pickled priest who was being flambed
You got me requisitioned Blondie
She's just a girl – she's a bomb


I'm happy, I'm ecstatic
Just a girl just a girl[x3]
She's just a girl


Look into the face of a child
Measure how long you smiled
Before the memory claimed
How long would children remain[x2]
Athena, you picked me up by my lapels and screamed ""leave her""
It felt like waking up in heaven on an empty meter
And now you are stuck with a castrated leader
And I hate the creep, I didn't mean that


She's a bomb
I just said it
She is a bomb
I didn't mean it, please
She's a bomb


Athena, I had no idea how much I need her
My life has been so settled and she is the reason
Just one word from her and my troubles are long gone
But I get along
She's just a girl, she's a bomb[x2]",rock
13,The Who,Baba O'Riley,http://genius.com/The-who-baba-oriley-lyrics,"{Lead In}

{Roger Daltrey}
Out here in the fields, I fight for my meals
I get my back into my living
I don't need to fight to prove I'm right
I don't need to be forgiven

{Pete Townshend}
Don't cry, don't raise your eye
It's only teenage wasteland

{Roger Daltrey}
Sally, take my hand, we'll travel south 'cross land
Put out the fire and don't look past my shoulder
The exodus is here,the happy ones are near
Let's get togetherbefore we get much older

{Roger Daltrey}
Teenage wasteland,it's only teenage wasteland
Teenage wasteland, oh, oh
Teenage wasteland,they're all wasted!

{Instrumental}",rock
14,The Who,Bargain,http://genius.com/The-who-bargain-lyrics,"I'd gladly lose me to find you
I'd gladly give up all I had
To find you I'd suffer anything and be glad
I'd pay any price just to get you
I'd work all my life and I will
To win you I'd stand naked, stoned and stabbed


I'd call that a bargain
The best I ever had[x2]


I'd gladly lose me to find you
I'd gladly give up all I got
To catch you I'm gonna run and never stop
I'd pay any price just to win you
Surrender my good life for bad
To find you I'm going to drown an unsung man




I sit looking around
I look at my face in the mirror
I know I'm worth nothing without you
And like one and one don't make two
One and one make one
And I'm looking for that free ride to me
I'm looking for you

{Instrumental}




I'd call that a bargain
The best I ever had
The best I ever had

{Instrumental}",rock
15,The Who,Behind Blue Eyes,http://genius.com/The-who-behind-blue-eyes-lyrics,"No one knows what it's like
To be the bad man, to be the sad man
Behind blue eyes

No one knows what it's like
To be hated, to be fated
To telling only lies

But my dreams, they aren't as empty
As my conscience seems to be
I have hours, only lonely
My love is vengeance that's never free

No one knows what it's like
To feel these feelings like I do
And I blame you

No one bites back as hard
On their anger, none of my pain and woe
Can show through

But my dreams, they aren't as empty
As my conscience seems to be
I have hours, only lonely
My love is vengeance that's never free

When my fist clenches, crack it open
Before I use it and lose my cool
When I smile, tell me some bad news
Before I laugh and act like a fool

And if I swallow anything evil
Put your finger down my throat
And if I shiver, please give me a blanket
Keep me warm, let me wear your coat

No one knows what it's like
To be the bad man, to be the sad man
Behind blue eyes",rock
16,The Who,Bell Boy prod. by Kit Lambert,http://genius.com/The-who-bell-boy-lyrics,"The beach is a place where a man can feel
He's the only soul in the world that's real
But I see a face coming through the haze
I remember him from those crazy days
Hazy days
Crazy days


Aren't you the guy who used to set the paces
Riding up in front of a hundred Faces
I don't suppose you would remember me
But I used to follow you back in '63


I've got a good job and I'mnewly born
You should see me dressed up in my uniform
I work in hotel all gilt and flash
Remember the gaff where the doors were smashed?


Bell Boy!
I got to keep running now
Bell Boy!
Keep my lip buttoned down
Bell Boy!
Carry this baggage out
Bell Boy! Always running at someone's bleeding heel
You know how I feel
Always running at someone's heel


Some nights I still sleep on the beach
Remember when stars were in reach
Then I wander in early to work
Spend my day licking boots for my perks






People often change
But when I look in your eyes
You could learn a lot
From a life like mine
The secret to me
It isn't flown like a flag
I carry it behind this bleeding little badge
What says

",rock
17,The Who,Christmas prod. by Kit Lambert,http://genius.com/The-who-christmas-lyrics,"Did you ever see the faces of the children? They get so excited
Waking up on Christmas morning hours before the winter sun's ignited
They believe in dreams and all they mean including heaven's generosity
Peeping round the door to see what parcels are for free in curiosity


And Tommy doesn't know what day it is
He doesn't know who Jesus was or what praying is
How can he be saved
From the eternal grave?


Surrounded by his friends he sits so silently and unaware of anything
Playing poxy pin ballpicks his nose and smiles and pokes his tongue at everything
I believe in love but how can men who've never seen light be enlightened?
Only if he's cured will his spirit's future level ever heighten


And Tommy doesn't know what day it is
He doesn't know who Jesus was or what praying is
How can he be saved
From the eternal grave?


Tommy can you hear me?
Tommy can you hear me?
Tommy can you hear me?
Tommy can you hear me?
Tommy can you hear me?
Can you hear me?
How can he be saved?


See me, feel me, touch me, heal me
See me, feel me, touch me, heal me!


Tommy can you hear me?
Tommy can you hear me?
Tommy can you hear me?
Tommy can you hear me?
Tommy can you hear me?
Can you hear me?
How can he be saved?


Did you ever see the faces of the children? They get so excited
Waking up on Christmas morning hours before the winter sun's ignited
They believe in dreams and all they mean including heaven's generosity
Peeping round the door to see what parcels are for free in curiosity


And Tommy doesn't know what day it is
He doesn't know who Jesus was or what praying is
How can he be saved
From the eternal grave?",rock
18,The Who,Cousin Kevin prod. by Kit Lambert,http://genius.com/The-who-cousin-kevin-lyrics,"We're on our own, cousin
All alone, cousin
Let's think of a game to play
Now the grownups have all gone away
You won't be much fun
Being blind, deaf, and dumb
But I've no one to play with today


Do you know how to play hide-and-seek?
To find me it would take you a week
But tied to that chair you won't go anywhere
There's a lot I can do with a freak

How would you feel if I turned on the bath
Ducked your head under and started to laugh
What would you do if I shut you outside
To stand in the rain and catch cold so you die?


I'm the school bully
The classroom cheat
The nastiest play-friend
You ever could meet
I'll stick pins in your fingers
And tread on your feet


We're on our own, cousin
All alone, cousin
Let's think of a game to play
Now the grownups have all gone away
You won't be much fun
Being blind, deaf, and dumb
But I've no one to play with today


Do you know how to play hide-and-seek?
To find me it would take you a week
But tied to that chair you won't go anywhere
There's a lot I can do with a freak

Maybe a cigarette burn on your arm
Would change your expression to one of alarm
Drag you around by a lock of your hair
Or give you a push at the top of the stairs


I'm the school bully
The classroom cheat
The nastiest play-friend
You ever could meet
I'll put glass in your dinner
And spikes in your seat",rock
19,The Who,Cut My Hair prod. by Kit Lambert,http://genius.com/The-who-cut-my-hair-lyrics,"Why should I care
If I have to cut my hair?
I got to move with the fashion
Or be outcast
I know I should fight
But my old man he's really alright
And I'm still living at home
Even though it won't last


Zoot suit,white jacket with side vents
Five inches long
I'm out on the street again
And I'm leaping along
Dressed right for a beach fight
But I just can't explain
Why that uncertain feeling
Is still here in my brain


The kids at school
Have parents that seem so cool
And though I don't want to hurt them
Mine want me their way
I clean my room and my shoes
But my mother found a box of blues
And there doesn't seem much hope
They'll
Let me stay




Why do I have to be different to them
Just to earn the respect of a dance hall friend
Have the same old row again and again
Why do I have to move with a crowd
Of kids that hardly notice I'm around
I work myself to death just to fit in

I'm coming down
Got home on the very first train from town
My dad just left for work
He wasn't talking
It's all a game
And inside I'm just the same
My fried egg makes me sick
First thing in the morning",rock
20,The Who,Doctor Jimmy prod. by Kit Lambert,http://genius.com/The-who-doctor-jimmy-lyrics,"Laugh and say I'm green
I've seen things you've never seen
Talk behind my back
I'm off the beaten track
I'll take on anyone
Ain't scared of a bloody nose
Drink till I drop down
With one eye on my clothes


What is it?
I'll take it
Who is she?
I'll rape it
Got a bet there?
I'll meet it
Getting high
You can't beat it


Doctor Jimmy and Mister Jim
When I'm pilled you don't notice him
He only comes out when I drink my gin


You say she's a virgin
But I'm gonna be the first in
Her fella's going to kill me?
Oh, fucking will he
I'm seeing d-double
Don't miss me if you can
There's gonna be trouble
When she choses her man


Is it me for a moment?
The stars are falling
The heat is rising
The past is calling
Is it me for a moment?
The stars are falling
The heat is rising
The past is calling


I'm going back soon
Home to get that baboon
Who cut up my eye
Tore up my Levis
I'm feeling restless
Bring another score around
Maybe something stronger
Could really hold me down





",rock
21,The Who,Don't Let Go The Coat,http://genius.com/The-who-dont-let-go-the-coat-lyrics,"I cannot be held responsible for blown behavior
I lost all contact with my only savior
No-one locked me out because I failed to phone up
I cannot bear to live forever like a loner


Do not let go the coat


It is easy to be sad: when you lack a partner
But how would I react to a broken heart now
It is not really true rock and roll unless I am
Hanging onto you and when I hold it next time


I will not let go the coat


I try to explain but you never understand it
I need your body but I cannot just demand it
I will not let go like a stray at heel
(Never let it out of your sight)
Every lonely wife knows the way I feel


(Do not let go tonight)
Do not let go the coat
Never let go the coat


Your friends all pass for life is just a market
But you have to finish everything you started
So I live my life tearing down the runway
Sure to get the hang of hanging in there someday


Do not let go the coat
Will  get no more chances - forget the war dances
Go blind and hang on – do not try the slang son
Never let go the coat",rock
