,artist,song,link,lyrics,genre
77,Led Zeppelin,For Your Life prod. by Jimmy Page,http://genius.com/Led-zeppelin-for-your-life-lyrics,"You said I was the only, With my lemon in your hand
Exhibition is your habit, Emotion second hand
Had to pull away to save me, Maybe next time around
And she said, don't you want it?
Don't you want cocaine-cocaine-cocaine
Hadn't planned to, could not stand to try it, fry it, na na na yeah
Heard a cry for mercy, In the city of the damned
Oh oh babe, damned. Down in the pits you go no lower
The next stop's underground. Oh, hello underground
Wine and roses aren't quite over, fate deals a losing hand
And I said: didn't mean to... did not mean to fail
You didn't plan it, you over-ran it
You want do it, you want to
You want do it when you want to
You want do it, do it when you want to
When you blow it, babe, You got to blow it right
Oh baby, if you fake it, mama, Baby, fake with all your might
When you fake it, mama, Please fake it right (for yourself babe)
When you fake it baby
You're faking it for your life, for your life, for your life, for your life
Do it, do it, do it, do it, do it, Do it when you want to
Do it, do it, do it, Do it when you want to
Oh, I can have you, baby, But I don't know what to do, yeah
Sometime, baby, nothing I could do
On the balance of a crystal, Paying through the nose
And when they couldn't resist you, I thought you'd go with the flow
And now your stage is empty, bring down the curtain, baby please
Fold up your show
Hadn't planned to, Could not stand to fry in it
Hadn't planned it, I over-ran it, (frying)
For your life, For your life",rock
78,Led Zeppelin,Friends prod. by Jimmy Page,http://genius.com/Led-zeppelin-friends-lyrics,"Bright light almost blinding, black night still there shining
I can't stop, keep on climbing, looking for what I knew
Had a friend, she once told me, You got love, you ain't lonely
Now she's gone and left me only looking for what I knew


Mmm, I'm telling you now, The greatest thing you ever can do now
Is trade a smile with someone who's blue now, It's very easy just


Met a man on the roadside crying, without a friend, there's no denying
You're incomplete, they'll be no finding looking for what you knew
So anytime somebody needs you, don't let them down, although it grieves you
Some day you'll need someone like they do, looking for what you knew

",rock
79,Led Zeppelin,Gallows Pole prod. by Jimmy Page,http://genius.com/Led-zeppelin-gallows-pole-lyrics,"Hangman, hangman, hold it a little while
I Think I see my friends coming, Riding a many mile
Friends, you get some silver?
Did you get a little gold?
What did you bring me, my dear friends? Keep me from theGallows Pole
What did you bring me to keep me from the Gallows Pole?


I couldn't get no silver, I couldn't get no gold
You know that we're too damn poor to keep you from the Gallows Pole
Hangman, hangman, hold it a little while
I think I see my brother coming, riding many a mile
Brother, you get me some silver?
Did you get a little gold?
What did you bring me, my brother, to keep me from the Gallows Pole?
Brother, I brought you some silver, yeah
I brought a little gold, I brought a little of everything
To keep you from the Gallows Pole
Yes, I brought you to keep you from the Gallows Pole


Hangman, hangman, turn your head awhile
I think I see my sister coming, riding many mile, mile, mile
Sister, I implore you, take him by the hand
Take him to some shady bower,save me from the wrath of this man
Please take him, save me from the wrath of this mad, man


Hangman, hangman, upon your face a smile
Tell me that I'm free to ride
Ride for many mile, mile, mile


Oh yes, you got a fine sister, She warmed my blood from cold
She warmed my blood to boiling hot to keep you from the Gallows Pole
Your brother brought me silver, Your sister warmed my soul
But now I laugh and pull so hard, see you swinging from the Gallows Pole[x2]
Swingin' on the gallows pole!


Ah-ha-ha
Swingin'
Swingin' on the gallows pole!
See-saw marjory daw
See-saw knock at my door",rock
80,Led Zeppelin,Going to California prod. by Jimmy Page,http://genius.com/Led-zeppelin-going-to-california-lyrics,"Spent my days with a woman unkind
Smoked my stuffand drank, all my wine
Made up my mind to make a new start
Going to California with an aching, in my heart
Someone told methere's a girl out there
With love in her eyesand flowers, in her hair

Took my chances on a big jet plane
Never let 'em tell you that they're all the same
The sea was red and the sky was grey
Wondered how tomorrow, could ever follow today
The mountains and the canyons start to tremble and shake
Asthe children of the sunbegan to awake
Seems that the wrath of the gods
Got a punch on the nose, and it started to flow
I think I might be sinking
Throw me a line, if I reach it in time
I'll meet you up there where the path runs straight and high


To find a queen without a king
They say she plays guitar and cries and sings... la la la
Ride a white mare in the footsteps of dawn
Tryin' to find a woman who's never, never, never been born
Standing on a hill in my mountain of dreams
Telling myself it's not as hard, hard, hard as it seems...",rock
81,Aerosmith,"Do They Know It's Christmas? by Band Aid  (Ft. Bananarama, Bono, Boomtown Rats, Boy George, David Bowie, Duran Duran, Frankie Goes To Hollywood, Tha Gang, George Michael, Heaven 17, Jody Watley, Kool, Marilyn, Michael Jackson, Paul McCartney, Paul Young, Phil Collins, Spandau Ballet, Status Quo, Sting, The Style Council & Ultravox) prod. by Bob Geldof & Midge Ure",http://genius.com/Band-aid-do-they-know-its-christmas-lyrics,"It's Christmas time
There's no need to be afraid
At Christmas time
We let in light and we banish shade


And in our world of plenty
We can spread a smile of joy
Throw your arms around the world
At Christmas time


But say a prayer
Pray for the other ones
At Christmas time it's hard


But when you're
There's ayour window
And it's a world of dread and fear


Where the only water flowing
Is the bitter sting of tears


And thethat ring there
Are the clanging chimes of doom


Well tonight thank God it's them
Instead of you


And there won't be snow in Africa this Christmas time
The greatest gift they'll get this year is life(Oooh)
Where nothing ever grows
No rain or rivers flow
Do they know it's Christmas time at all?


Here's to you


Raise a glass for everyone


Here's to them


Underneath that burning sun
Do they know it's Christmas time at all?



Feed the world
Feed the world
Let them know it's Christmas time again

Feed the world
Let them know it's Christmas time again",rock
82,Aerosmith,Dream On,http://genius.com/Aerosmith-dream-on-lyrics,"Everytime that I look in the mirror
All these lines on my face getting clearer
The past is gone, it went by like dusk to dawn
Isn't that the way, everybody got the dues in life to pay
I know nobody knows
Where it comes and where it goes
I know it's everybody's sin
You got to lose to know how to win


Half my life's in books written pages
Lived and learned from fools and from sages
You know it's true
All the things come back to you


Sing with me, sing for the year
Sing for the laughter and sing for the tear
Sing with me, just for today
Maybe tomorrow the good Lord'll take you away
Sing with me, sing for the year
Sing for the laughter and sing for the tear
Sing with me, just for today
Maybe tomorrow the good Lord'll take you away


Dream on, dream on, dream on
Dream until your dream come true
Dream on, dream on, dream on
Dream until your dream come true


Dream on, dream on
Dream on, dream on
Dream on, dream on
Dream on


Sing with me, sing for the year
Sing for the laughter and sing for the tear
Sing with me, just for today
Maybe tomorrow the good Lord'll take you away
Sing with me, sing for the year
Sing for the laughter and sing for the tear
Sing with me, just for today
Maybe tomorrow the good Lord'll take you away",rock
83,Aerosmith,Walk This Way by Run-D.M.C.,http://genius.com/Run-dmc-walk-this-way-lyrics,"backseat lover,that's always undercover
And we talk 'til my daddy say
Said you ain't seen nothing, 'til you're down on a muffin
And there's sure to be a change in ways
Now there's a cheerleader, that's a real big breeder
As far as I can reminisce
But the best thing of loving, was her sister and her cousin
And it started with a little kiss, like this!

{*Joe Perry plays guitar riff*}


See-saw swinging, with the boys in school
And her feet are just fly up in the air
Singing, ""Hey diddle diddle with a kitty in the middle""
And they swinging like it just didn't care
So I took a big chance, At the high school dance
With a lady who was ready to play
It wasn't me, she was foolin'
Cause she knew what was she was doin'
When she told me how to walk this way!


Walk this way
Talk this way
Walk this way
Talk this way
Walk this way
Talk this way
Walk this way
Talk this way
Well just gimme a kiss

{*Joe Perry plays guitar riff*}
Oooh, like this!


School girl sleazy with a classy kind of sassy
Little skirt climbing way up her knee
It was three young ladies, in the school gym locker
And they find they were looking at D
I was high school loser, never made it with a lady
'Til a boy told me something I missed
That my next door neighbor, had a daughter had a favor
So I gave the girl a little kiss, like this


See-saw swinging with the boys in the school
With her feet flying up in the air
Singing, ""Hey diddle diddle, with a kitty in the middle""
I was swinging like I didn't care
So I took a big chance at the high school dance
With a lady who was ready to play
Wasn't me she was foolin'
When she knew what she was doin'
When she told me how to walk this way

",rock
84,Aerosmith,Cryin',http://genius.com/Aerosmith-cryin-lyrics,"There was a time
When I was so broken hearted
Love wasn't much of a friend of mine
The tables have turned, yeah
Cause me and them ways have parted
That kind of love was the killin' kind
Now listen
All I want is someone I can't resist
I know all I need to know by the way that I got kissed


I was crying when I met you
Now I'm trying to forget you
Love is sweet misery
I was crying just to get you
Now I'm dying cause I let you
Do what you do - down on me


Now there's not even breathing room
Between pleasure and pain
Yeah, you cry when we're making love
Must be one and the same


It's down on me
Yeah I got to tell you one thing
It's been on my mind
Girl, I gotta say
We're partners in crime
You got that certain something
What you give to me
Takes my breath away
Now the word out on the street
Is the devil's in your kiss
If our love goes up in flames
It's a fire I can't resist




Cause what you got inside
Ain't where your love should stay
Yeah, love, sweet love, ain't love
'Til you give your heart away


I was cryin' when I met you
Now I'm tryin' to forget you
Your love is sweet misery
I was cryin' just to get you
Now I'm dyin' just to let you
Do what you do what you do down to me
Baby, baby, baby
I was cryin' when I met you
Now I'm tryin' to forget you
Your love is sweet misery
I was cryin' when I met you
Now I'm dyin' cause I let you
Do what you do down to , down to, down to, down to
I was cryin' when I met you
Now I'm dyin' to forget you
Your love is sweet
I was cryin' when I met you",rock
85,Aerosmith,Janie's Got a Gun,http://genius.com/Aerosmith-janies-got-a-gun-lyrics,"Dum, dum, dum, honey what have you done?
Dum, dum, dum it's the sound of my gun
Dum, dum, dum, honey what have you done?
Dum, dum, dum it's the sound


Janie's got a gun
Janie's got a gun
Her whole world's come undone
From lookin' straight at the sun
What did her daddy do?
What did he put you through?


They said when Janie was arrested
They found him underneath a train
But man, he had it comin'
Now that Janie's got a gun
She ain't never gonna be the same


Janie's got a gun
Janie's got a gun
Herdog day's just begun
Now everybody is on the run
Tell me now it's untrue
What did her daddy do?
He jacked a little bitty baby
The man has got to be insane
They say the spell that he was under the lightning and
The thunder knew that someone had to stop the rain


Run away, run away from the pain yeah, yeah yeah yeah
Run away run away from the pain yeah yeah
Yeah yeah yeah yeah yeah
Run away, run away, run, run away


Janie's got a gun
Janie's got a gun
Her dog day's just begun
Now everybody is on the run


What did her daddy do?
It's Janie's last I.O.U
She had to take him down easy and put a bullet in his brain
She said cause nobody believes me. The man was such a sleeze
He ain't never gonna be the same


Run away, run away from the pain yeah, yeah
Yeah yeah yeah
Run away run away from the pain yeah yeah
Yeah yeah yeah yeah yeah
Run away, run away, run, run away


Janie's got a gun
Janie's got a gun
Janie's got a gun
Everybody is on the run


Janie's got a gun
Her dog day's just begun
Now everybody is on the run
Because Janie's got a gun
Janie's got a gun
Her dog day's just begun
Now everybody is on the run
Janie's got a gun",rock
86,Aerosmith,The Other Side,http://genius.com/Aerosmith-the-other-side-lyrics,"Loving you has go to be (take me to the other side)
Like the devil and the deep blue sea (take me to the other side)
Forget about your foolish pride (take me to the other side)
Oh take me to the other side (take me to the other side)


My mamma told me there'd be days like this
And man, she wasn't fooling
Because I just can't believe the way you kiss
Uh uh huh
You opened up your mouth with baited breath
You said you'd never leave me
You love me, you hate me, I tried to take the loss
You're crying me a river but I got to get across




I'm looking for another kind of love
Oh Lordy, how I need it
The kind that likes to leap without a shove
Oh, honey, best believe it
To save a lot of time and foolish pride I'll say what's on my mind, girl
You loved me, you hate me, you cut me down to size
You blinded me with love and yeah it opened up my eyes




Take me to the other side
I'm looking for another kind of love
Oh Lordy, how I need it
The kind that likes to leap without a shove
Honey, best you believe it
Now I'm not one for saying long goodbyes
I hope all is forgiven
You loved me, you hate me, I used to be your lover
You know you had it coming girl so take me to the other

",rock
87,Aerosmith,Walk This Way,http://genius.com/Aerosmith-walk-this-way-lyrics,"Backstroke lover always hiding 'neath the covers
Untill I talked to my daddy he say
He said, ""You ain't seen nothing
Untill you're down on a muffin
Then you're sure to be a-changing your ways""
I met a cheerleader, was a real young bleeder
All the times I can reminisce
Ah the best thing loving
With her sister and her cousin
Started with a little kiss, like this
See-saw swinging with the boys in the school
With your feet flying up in the air
Singing hey diddle-diddle with the kitty in the middle
You be swinging like you just didn't care
So I took a big chance at the high school dance
With a missy who was ready to play
Was it me she was fooling?
Cause she knew what she was doing
Taught me how to walk this way
She told me to


""Walk this way, talk this way[x4]
Ah, just give me a kiss
Gimme some, gimme some, gimme some, yeah


School girl sadie with the classy kinda sassy
Little skirt climbing way up her knees
There was three young ladies in the school gym locker
When I noticed they was looking at me
I was a high school loser
Never made it with a lady
Till the boys told me something I missed
Then my next door neighbour
With a daughter had a favour
Tookme just a little kiss, like this
See-saw swinging with the boys in the school
With your feet flying up in the air
Singing hey diddle-diddle with the kitty in the middle
You be swinging like you just didn't care
So I took a big chance at the high school dance
With a missy who was ready to play
Was it me she was fooling?
Cause she knew what she was doing
Told me how to walk this way
She told me to

",rock
88,Aerosmith,Adam's Apple,http://genius.com/Aerosmith-adams-apple-lyrics,"Back when Cain was able
Way before the stable
Lighting struck right down from the sky
A mother ship with fate said let's give it a try
Conscience was related
Man he was created
Lady luck took him by surprise
A sweet and bitter fruit
It surely opened his eyes
Well she ate it
Lordy it was love at first bite
Well she ate it
Never knowin wrong from right
Even Eve in Eden
Voices tried deceiving
With lies that showed the lady the way
At first she stopped turned and tried to walk away
Man he was believer
Lady was deceiver
So the story goes but you see
That snake was he
She just climbed right up his tree


Evil came like raining
Who knows who's to blaming
Something tried to lay her to waste
And all she want and need was just a little taste",rock
89,Aerosmith,Ain't that a bitch,http://genius.com/Aerosmith-aint-that-a-bitch-lyrics,"Up in smoke you've lost another lover
As you take a hit off your last cigarette
Strung out, burn out
Yeah you're down on your luck
And you don't give a
Until the best part of you starts to twitch
Isn't that a bitch


Freak out! I'm alone now
I feel just like I'm losing my mind
Because love is like the right dress
On the wrong girl
You never know what you're going to find
You think you're high and fine as wine
Then you wind up like a dog in a ditch
Because love is like a wrong turn
On a cold night...yeah
Isn't that a bitch, isn't that a bitch


In a daze
In the throes of emotion
You see God in the Devil's eyes
Then you fall so far from grace
You wouldn't know a kiss
If it was on your face
You can tell it to the jury
But you aren't got no case




Then you feel so out of place
Licking up the arsenic
From the same old lace
You know the stuff is poison
But you got to have a taste

",rock
90,Aerosmith,Amazing,http://genius.com/Aerosmith-amazing-lyrics,"I kept the right ones out
And let the wrong ones in
Had an angel of mercy to see me through all my sins
There were times in my life
When I was goin' insane
Tryin' to walk through the pain
When I lost my grip, and I hit the floor
Yeah, I thought I could leave but couldn't get out the door
I was so sick and tired of livin' a lie
I was wishin that I would die



It's amazing
With the blink of an eye you, finally see the light
It's amazing
When the moment arrives that you know you'll be alright
It's amazing
And I'm sayin' a prayer for the desperate hearts tonight



That one last shot's apermanent vacation
And how high can you fly with broken wings?
Life's a journey, not a destination
And I just can't tell just what tomorrow brings



You have to learn to crawl
Before you learn to walk
But I just couldn't listen to all that righteous talk, oh yeah
I was out on the street
Just tryin' to survive
Scratchin' to stay alive



It's amazing
With the blink of an eye you finally see the light
It's amazing
When the moment arrives that you know you'll be alright
It's amazing
And I'm sayin' a prayer for the desperate hearts tonight



Desperate hearts, desperate hearts....",rock
91,Aerosmith,Angel,http://genius.com/Aerosmith-angel-lyrics,"I'm alone
Yeah, I don't know if I can face the night
I'm in tears, and the cryin' that I do is for you
I want your love - let's break the walls between us
Don't make it tough - I'll put away my pride
Enough's enough, I've suffered and I've seen the light


Baby
You're my angel
Come and save me tonight
You're my angel
Come and make it all right


Don't know what I'm going to do
About this feeling inside
Yes it's true - loneliness took me for a ride
Without your love - I'm nothing but a begger
Without your love - a dog without a bone
What can I do? I'm sleeping in this bed alone




You're the reason I live
You're the reason I die
You're the reason I give
When I break down and cry
Don't need no reason why
Baby, baby




Come and save me tonight[x5]",rock
92,Aerosmith,Back In the Saddle,http://genius.com/Aerosmith-back-in-the-saddle-lyrics,"I'M BACK!
I'M BACK in the saddle again
I'M BACK!
I'M BACK in the saddle again


Riding into town alone
By the light of the moon
I'm looking for all Sukie Jones
She crazy horse saloon
Barkeep give me a drink
That's when she caught my eye
She turned to give me a wink
That'd make a grown man cry




Umm...come easy, go easy
Alright until the rising sun
I'm calling all the shots tonight
I'm like a loaded gun
Peeling off my boots and chaps
I'm saddle sore
Four bits gets you time in the racks
I scream for more
Fools and gold out of their mines
The girls are soaking wet
No tongue's drier than mine
I'll come when I get back


I'm back in the saddle again
I'm back
I'm back in the saddle again
I'm riding, I'm loading up my pistol
I'm riding, I really got a fistful
I'm riding, I'm shining up my saddle
I'm riding, this snake is going to rattle




Riding high[x2]
Riding high already",rock
93,Aerosmith,Beyond Beautiful,http://genius.com/Aerosmith-beyond-beautiful-lyrics,"You gave up the love you got &amp; that is fact
She loves me now she loves you not and that where its at
Cause when you thought your love was deep
Finders keepers losers weep yeah
Love my love my love du jour she is mine all mine
My minds made up ya i'm so sure because theres none so fine
The thing you found your losing sleep its all about the love you keep


Yeahs she is beyond beautiful
Yeah she never been nobodys fool that she'd be stuck with
Yeah it is all about me &amp; you
Believe or not theres nothing we got
Thats beyond beautiful


Full of lust
Full of love
Without no clue
And though i was the one sure of
And then came you
Into my life it served me right
Nobody ever did it quite like you




Yeah she's beyond beautiful
Yeah she never been nobodys fool that you'd be stuck with
Yeah its all about me &amp; you
Believe or not yeah what we got
It is beyond beautiful",rock
94,Aerosmith,Big Ten Inch Record prod. by Jack Douglas,http://genius.com/Aerosmith-big-ten-inch-record-lyrics,"Got me the strangest woman
Believe me this trick's no cinch
But I really get her going
When I whip out my big ten inch


Record of a band that plays the blues
Well a band that plays its blues
She just love my big ten inch
Record of her favorite blues


Last night I tried to tease her
I gave my love a little pinch
She said now stop that jivin'
Now whip out your big ten inch




I, I, I cover her with kisses
And when we're in a lover's clinch
She gets all excited
When she begs for my big ten inch




My girl don't go for smoking
And liquor just make her flinch
Seems she don't go for nothing


'Cept on my big ten inch
Record of a band that plays the blues
Band that play the blues
She just love my big ten inch
Record of her favorite blues",rock
95,Aerosmith,Blind Man,http://genius.com/Aerosmith-blind-man-lyrics,"I took a course in Hallelujah
I went to night school for de blues
I took some stuff they said would cool ya...hea ha
But nothing seemed to light my fuse
But that's all in the past
Like a check that's in the mail
She was a tall whiskey glass
I was an old hound dog
That just loved to chase his tail


Until I met a Blind Man
Who taught me how to see...yeah
A Blind Man
Who could change night into day
And if a I can
I'm going to make you come with me...yeah
Because a here come the sun
And we'll be chasing all the clouds away...yeah yeah


I've had some lovers like a joyride
Some things are never what they seem
My heaven's turned into a landslide
Thank God I woke up from that dream


I met a Blind Man
Who taught me how to see...yeah
Blind Man
Who could change night into day
And if a I can
I'm going to make you come with me...yeah
Beacuse a here comes the sun
And we'll be chasing all the clouds the way
The bee's chase honey
And drink all the flowers dry
We'll be saving us a little money
And if that doesn't do it, yeah
I know the reason why


Don't make no sense lighting candles
There's too much moonlight in my eyes


I met a Blind Man
Who taught me how to see...yeah
Blind Man
Who could change night into day
And if a I can
I'm going to make you come with me...ah ah ah ah yeah
Because a here come the sun
Ain't no surprise
Ain't no doubt about it
Going to open up my eyes",rock
96,Aerosmith,Crazy,http://genius.com/Aerosmith-crazy-lyrics,"Say you're leavin' on a seven thirty train and that you're headin'
Out to Hollywood
Girl you been givin' me that line so many times it kinda gets like
Feelin' bad looks good

[Bridge:Aerosmith]
That kinda loving
Turns a man to a slave
That kinda loving
Sends a man right to his grave


I go crazy, crazy, baby, I go crazy
You turn it on
Then you're gone
Yeah you drive me
Crazy, crazy, crazy, for you baby
What can I do, honey
I feel like the colorblue


You're packing up your stuff and talking like it's tough and trying
To tell me that it's time to go
But I know you ain't wearing nothing underneaththatovercoat
And it's all a show


That kind of loving
Makes me want to pull
Down the shade, yeah
That kind of loving
Yeah now I'm never, never, never, never gonna be the same


I go crazy, crazy, baby, I go crazy
You turn it on
Then you're gone
Yeah you drive me
Crazy, crazy, crazy, for you baby
What can I do, honey
I feel like the color blue


I'm losing my mind, girl
Cause I'm going crazy
I need your love, honey
I need your love


Crazy, crazy, crazy, I go crazy
You turn it on
Then you're gone
Yeah you drive me
Crazy, crazy, crazy, for you baby
I'm losing my mind, girl
Cause I'm going crazy
Crazy, crazy, crazy for you baby
You turn it on, then your gone
Yeah you drive me",rock
