,artist,song,link,lyrics,genre
194,The Beatles,A Day In The Life prod. by George Martin,http://genius.com/The-beatles-a-day-in-the-life-lyrics,"I read the news today, oh boy
About a lucky man who made the grade
And though the news was rather sad
Well I just had to laugh
I saw the photograph
He blew his mind out in a car
He didn't notice that the lights had changed
A crowd of people stood and stared
They'd seen his face before
But nobody was really sure
If he was from the House of Lords
I saw a film today oh boy
The English Army had just won the war
A crowd of people turned away
But I just had to look
Having read the book
I'd love to turn you on


Woke up, fell out of bed
Dragged a comb across my head
Found my way downstairs and drank a cup
And looking up I noticed I was late
Found my coat and grabbed my hat
Made the bus in seconds flat
Found my way upstairs and had a smoke
And somebody spoke and I went into a dream


I read the news today, oh boy
4,000 holes in Blackburn, Lancashire
And though the holes were rather small
They had to count them all
Now they know how many holes it takes to fill the Albert Hall
I'd love to turn you on",rock
195,The Beatles,Eleanor Rigby prod. by George Martin,http://genius.com/The-beatles-eleanor-rigby-lyrics,"Ah, look at all the lonely people!
Ah, look at all the lonely people!


Eleanor Rigby picks up the rice
In the church where a wedding has been
Lives in a dream
Waits at the window
Wearing the face that she keeps in a jar by the door
Who is it for?


All the lonely people
Where do they all come from?
All the lonely people
Where do they all belong?


Father McKenzie
Writing the words of a sermon that no one will hear
No one comes near
Look at him working
Darning his socks in the night when there's nobody there
What does he care?


All the lonely people
Where do they all come from?
All the lonely people
Where do they all belong?


Ah, look at all the lonely people!
Ah, look at all the lonely people!


Eleanor Rigby died in the church
And was buried along with her name
Nobody came
Father McKenzie wiping the dirt
From his hands as he walks from the grave
No one was saved


All the lonely people
Where do they all come from?
All the lonely people
Where do they all belong?",rock
196,The Beatles,Across The Universe prod. by Phil Spector,http://genius.com/The-beatles-across-the-universe-lyrics,"Words are flowing out like endless rain into a paper cup
They slither wildly as they slip away across the universe
Pools of sorrow, waves of joy are drifting through my open mind
Possessing and caressing me
Jai Guru Deva OM


Nothing's going to change my world
Nothing's going to change my world
Nothing's going to change my world
Nothing's going to change my world


Images of broken light which dance before me like a million eyes
They call me on and on across the universe
Thoughts meander like a restless wind inside a letter box
They tumble blindly as they make their way across the universe
Jai Guru Deva OM




Sounds of laughter shades of life are ringing through my open ears
Inciting and inviting me
Limitless undying love which shines around me like a million suns
It calls me on and on, across the universe
Jai Guru Deva OM




Jai Guru Deva
Jai Guru Deva
Jai Guru Deva
Jai Guru Deva
Jai Guru Deva",rock
197,The Beatles,Act Naturally,http://genius.com/The-beatles-act-naturally-lyrics,"They're gonna put me in the movies
They're gonna make a big star out of me
We'll make a film about a man that's sad and lonely
And all I gotta do is act naturally


Well, I'll bet you I'm gonna be a big star
Might win an Oscar you can never tell
The movies gonna make me a big star
Cos I can play the part so well


Well I hope you'll come and see me in the movies
Then I know that you will plainly see
The biggest fool that ever hit the big time
And all I gotta do is act naturally


We'll make the scene about a man that's sad and lonely
And begging down upon his bended knee
I'll play the part and I won't need rehearsing
All I gotta do is act naturally



",rock
198,The Beatles,A Day In The Life prod. by George Martin,http://genius.com/The-beatles-a-day-in-the-life-lyrics,"I read the news today, oh boy
About a lucky man who made the grade
And though the news was rather sad
Well I just had to laugh
I saw the photograph
He blew his mind out in a car
He didn't notice that the lights had changed
A crowd of people stood and stared
They'd seen his face before
But nobody was really sure
If he was from the House of Lords
I saw a film today oh boy
The English Army had just won the war
A crowd of people turned away
But I just had to look
Having read the book
I'd love to turn you on


Woke up, fell out of bed
Dragged a comb across my head
Found my way downstairs and drank a cup
And looking up I noticed I was late
Found my coat and grabbed my hat
Made the bus in seconds flat
Found my way upstairs and had a smoke
And somebody spoke and I went into a dream


I read the news today, oh boy
4,000 holes in Blackburn, Lancashire
And though the holes were rather small
They had to count them all
Now they know how many holes it takes to fill the Albert Hall
I'd love to turn you on",rock
199,The Beatles,A Hard Day's Night,http://genius.com/The-beatles-a-hard-days-night-lyrics,"It's been a hard day's night
And I've been working like a dog
It's been a hard day's night
I should be sleeping like a log
But when I get home to you
I find the things that you do
Will make me feel alright

You know I work all day
To get you money to buy you things
And it's worth it just to hear you say
You're going to give me everything
So why on earth should I moan
Because when I get you alone
You know I feel ok

When I'm home everything seems to be right
When I'm home feeling you holding me tight, tight, yeh

It's been a hard day's night
And I've been working like a dog
It's been a hard day's night
I should be sleeping like a log
But when I get home to you
I find the things that you do
Will make me feel alright

Aw!

So why on earth should I moan
Because when I get you alone
You know I feel ok

When I'm home everything seems to be right
When I'm home feeling  you holding me tight, tight, yeh

It's been a hard day's night
And I've been working like a dog
It's been a hard day's night
I should be sleeping like a log
But when I get home to you
I find the things that you do
Will make me feel alright

You know I feel alright
You know I feel alright",rock
200,The Beatles,All My Loving,http://genius.com/The-beatles-all-my-loving-lyrics,"Close your eyes and I'll kiss you
Tomorrow I'll miss you
Remember I'll always be true
And then while I'm away
I'll write home everyday
And I'll send all my loving to you


I'll pretend that I'm kissing
The lips I am missing
And hope that my dreams will come true
And then while I'm away
I'll write home every day
And I'll send all my loving to you


All my loving I will send to you
All my loving, darling I'll be true




All my loving I will send to you
All my loving, darling I'll be true
All my loving, all my loving ooh
All my loving I will send to you",rock
201,The Beatles,All My Loving (Original Mono),http://genius.com/The-beatles-all-my-loving-original-mono-lyrics,"Close your eyes and I'll kiss you
Tomorrow I'll miss you
Remember I'll always be true
And then while I'm away
I'll write home every day
And I'll send all my loving to you
I'll pretend that I'm kissing
The lips I am missing
And hope that my dreams will come true
And then while I'm away
I'll write home every day
And I'll send all my loving to you
All my loving, I will send to you
All my loving, darling I'll be true
Close your eyes and I'll kiss you
Tomorrow I'll miss you
Remember I'll always be true
And then while I'm away
I'll write home every day
And I'll send all my loving to you
All my loving, I will send to you
All my loving, darling I'll be true
All my loving, all my loving
Woo, all my loving, I will send to you",rock
202,The Beatles,All Things Must Pass,http://genius.com/The-beatles-all-things-must-pass-lyrics,,rock
203,The Beatles,All You Need Is Love,http://genius.com/The-beatles-all-you-need-is-love-lyrics,"Love


There's nothing you can do that can't be done
Nothing you can sing that can't be sung
Nothing you can say, but you can learn how to play the game
It's easy


Nothing you can make that can't be made
No one you can save that can't be saved
Nothing you can do, but you can learn how to be you in time
It's easy


All you need is love
All you need is love
All you need is love, love
Love is all you need


There's nothing you can know that isn't known
Nothing you can see that isn't shown
There's nowhere you can be that isn't where you're meant to be
It's easy




All you need is love (All together now)
All you need is love (Everybody)
All you need is love, love
Love is all you need
(Yesterday)
(Oh yeah)
(She loves you, yeah, yeah, yeah)
(She loves you, yeah, yeah, yeah)
(Oh, yesterday)",rock
204,The Beatles,And I Love Her,http://genius.com/The-beatles-and-i-love-her-lyrics,"I give her all my love
That's all I do
And if you saw my love
You'd love her too
I love her


She gives me everything
And tenderly
The kiss my lover brings
She brings to me
And I love her


A love like ours
Could never die
As long as I
Have you near me


Bright are the stars that shine
Dark is the sky
I know this love of mine
Will never die
And I love her",rock
205,The Beatles,And I Love Her by Kurt Cobain  prod. by Kurt Cobain,http://genius.com/Kurt-cobain-and-i-love-her-lyrics,,rock
206,The Beatles,And Your Bird Can Sing prod. by George Martin,http://genius.com/The-beatles-and-your-bird-can-sing-lyrics,"You tell me that you've got everything you want
And your bird can sing
But you don't get me
You don't get me


You say you've seen seven wonders
And your bird is green
But you can't see me
You can't see me


When your prized possessions
Start to weigh you down
Look in my direction
I'll be round, I'll be round


When your bird is broken
Will it bring you down?
You may be awoken
I'll be round, I'll be round


You tell me that you've heard every sound there is
And your bird can swing
But you can't hear me
You can't hear me",rock
207,The Beatles,Anna (Go To Him),http://genius.com/The-beatles-anna-go-to-him-lyrics,"Anna
You come and ask me, girl
To set you free, girl
You say he loves you more than me
So I will set you free
Go with him
Go with him


Anna
Girl, before you go now
I want you to know, now
That I still love you so
But if he loves you more
Go with him


All of my life
I've been searching for a girl
To love me like I love you
Oh, now, but every girl I've ever had
Breaks my heart and leaves my sad
What am I, what am I supposed to do


Anna
Just one more thing, girl
You give back your ring to me, and I will set you free
Go with him

",rock
208,The Beatles,Another Girl,http://genius.com/The-beatles-another-girl-lyrics,"For I have got another girl, another girl


You're making me say that I've got nobody but you
But as from today, well, I've got somebody that's new
I ain't no fool and I don't take what I don't want
For I have got another girl, another girl
She's sweeter than all the girls and I met quite a few
Nobody in all the world can do what she can do
And so I'm telling you, ""This time you'd better stop""


For I have got another girl
Another girl, who will love me till the end
Through thick and thin
She will always be myfriend


I don't want to say that I've been unhappy with you
But, as from today, well, I've seen somebody that's new
I ain't no fool and I don't take what I don't want
For I have got another girl
Another girl, who will love me till the end
Through thick and thin
She will always be my friend


I don't want to say that I've been unhappy with you
But, as from today, well, I've seen somebody that's new
I ain't no fool and I don't take what I don't want
For I have got another girl. Another girl
Another girl",rock
209,The Beatles,Any Time At All,http://genius.com/The-beatles-any-time-at-all-lyrics,"Any time at all, any time at all
Any time at all, all you've gotta do is call and I'll be there


If you need somebody to love
Just look into my eyes
I'll be there to make you feel right

If you're feeling sorry and sad
I'd really sympathize
Don't you be sad, just call me tonight




If the sun has faded away
I'll try to make it shine
There's nothing I won't do
When you need a shoulder to cry on
I hope it will be mine
Call me tonight, and I'll come to you

",rock
210,The Beatles,Ask Me Why,http://genius.com/The-beatles-ask-me-why-lyrics,"I love you, because you tell me things I want to know
And it's true that it really only goes to show
That I know
That I, I, I, I
Should never, never, never be blue

Now you're mine, my happiness still makes me cry
And in time, you'll understand the reason why
If I cry
It's not because I'm sad
But you're the only love that I've ever had


I can't believe it's happened to me
I can't conceive of any more misery


Ask me why, I'll say I love you
And I'm always thinking of you


I love you, because you tell me things I want to know
And it's true that it really only goes to show
That I know
That I, I, I, I
Should never, never, never be blue


Ask me why, I'll say I love you
And I'm always thinking of you



",rock
211,The Beatles,A Taste Of Honey,http://genius.com/The-beatles-a-taste-of-honey-lyrics,"A taste of honey! Tasting much sweeter than wine


I dream of your first kiss, and then
I feel upon my lips again
A taste of honey! Tasting much sweeter than wine


I will return, yes I will return
I'll come back for the honey and you


Yours was the kiss that awoke my heart
There lingers still, though we're far apart
That taste of honey! Tasting much sweeter than wine


I will return, yes I will return
I'll come back (he'll come back) for the honey (for the honey) and you",rock
212,The Beatles,Baby's In Black,http://genius.com/The-beatles-babys-in-black-lyrics,"Oh dear, what can I do?
Baby's in black and I'm feeling blue
Tell me, oh what can I do?


She thinks of him and so she dresses in black
And though he'll never come back,she's dressed in black
Oh dear, what can I do?
Baby's in black and I'm feeling blue
Tell me, oh what can I do?


I think of her, but she thinks only of him
And though it's only a whim, she thinks of him
Oh how long will it take
Till she sees the mistake she has made?
Dear what can I do?
Baby's in black and I'm feeling blue
Tell me, oh what can I do?

{Instrumental}

Oh how long it will take
Till she sees the mistake she has made?
Dear what can I do?
Baby's in black and I'm feeling blue
Tell me, oh what can I do?


She thinks of him and so she dresses in black
And though he'll never come back, she's dressed in black
Oh dear, what can I do?
Baby's in black and I'm feeling blue
Tell me, oh what can I do?",rock
213,The Beatles,Baby You're a Rich Man,http://genius.com/The-beatles-baby-youre-a-rich-man-lyrics,"How does it feel to be
One of the beautiful people?
Now that you know who you are
What do you want to be?
And have you travelled very far?
Far as the eyes can see


How does it feel to be
One of the beautiful people?
How often have you been there?
Often enough to know
What did you see when you were there?
Nothing that doesn't show
Baby you're a rich man
Baby you're a rich man
Baby you're a rich man too
You keep all your money in a big brown bag inside a zoo
What a thing to do
Baby you're a rich man
Baby you're a rich man
Baby you're a rich man too


How does it feel to be
One of the beautiful people?
Tuned to a natural E
Happy to be that way
Now that you've found another key
What are you going to play?
Baby you're a rich man
Baby you're a rich man
Baby you're a rich man too
You keep all your money in a big brown bag inside a zoo
What a thing to do
Baby, baby you're a rich man
Baby you're a rich man
Baby you're a rich man too
Baby you're a rich man
Baby you're a rich man
Baby, baby you're a rich man too(fade out)",rock
214,The Beatles,Back in the U.S.S.R. prod. by Chris Thomas & George Martin,http://genius.com/The-beatles-back-in-the-ussr-lyrics,"Flew in from Miami Beach BOAC
Didn't get to bed last night
On the way the paper bag was on my knee
Man I had a dreadful flight
I'm back in the U.S.S.R
You don't know how lucky you are boy
Back in the U.S.S.R

Been away so long I hardly knew the place
Gee it's good to be back home
Leave it till tomorrow to unpack my case
Honey disconnect the phone
I'm back in the U.S.S.R
You don't know how lucky you are boy
Back in the U.S. Back in the U.S.Back in the U.S.S.R


Well the Ukraine girls really knock me out
They leave the West behind
And Moscow girls make me sing and shout
That Georgia's always on my mind


I'm back in the U.S.S.R
You don't know how lucky you are boys
Back in the U.S.S.R


Well the Ukraine girls really knock me out
They leave the West behind
And Moscow girls make me sing and shout
That Georgia's always on my mind


Show me round your snow-peaked mountains way down south
Take me to your daddy's farm
Let me hear your balalaikas ringing out
Come and keep your comrade warm
I'm back in the U.S.S.R
You don't know how lucky you are boys
Back in the U.S.S.R",rock
215,The Beatles,Bad Boy,http://genius.com/The-beatles-bad-boy-lyrics,"A bad little kid moved into my neighborhood
He won't do nothing right, just sitting down and looks so good
He don't want to go to school and learn to read and write
Just sits around the house and plays the rock and roll music all night
Well, he put some tacks on teachers chair
Puts chewing gum in little girl's hair
Hey, junior, behave yourself

Buys every rock and roll book on the magazine stand
Every dime that he gets (oh) is lost to the jukebox man
Well he worries his teacher till at night she's ready to poop
From rocking and a-rolling to spinning in a hula hoop
Well this rock and roll has got to stop
Junior's head is hard as rock
Now, junior, behave yourself

Ooh!



Ooh!

Gonna tell your mama you better do what she said
Get to the barber shop and get that hair cut off your head
Threw the canary and you fed it to the neighbor's cat
You gave the cocker spaniel a bath in mother's laundromat
Well, in mama's head it's got to stop
Junior's head is hard as rock
Now, junior, behave yourself



We all miss you; You miss them?
Yeah!
The Beatles miss you; all the Beatles missed you
Now, junior, behave yourself",rock
216,Guns N' Roses,November Rain,http://genius.com/Guns-n-roses-november-rain-lyrics,"When I look into your eyes
I can see a love restrained
But darlin' when I hold you
Don't you know I feel the same
Cause nothing lasts forever
And we both know hearts can change
And it's hard to hold a candle
In the cold November rain
We've been through this such a long long time
Just trying to kill the pain
But lovers always come and lovers always go
And no one's really sure who's lettin' go today
Walking away
If we could take the time
To lay it on the line
I could rest my head
Just knowin' that you were mine
All mine
So if you want to love me
Then darlin' don't refrain
Or I'll just end up walking
In the cold November rain


Do you need some time... on your own
Do you need some time... all alone
Everybody needs some time... on their own
Don't you know you need some time... all alone


I know it's hard to keep an open heart
When even friends seem out to harm you
But if you could heal a broken heart
Wouldn't time be out to charm you




Sometimes I need some time... on my own
Sometimes I need some time... all alone
Everybody needs some time... on their own
Don't you know you need some time... all alone


And when your fears subside
And shadows still remain
I know that you can love me
When there's no one left to blame
So never mind the darkness
We still can find a way
Cause nothin' lasts forever
Even cold November rain




Don't ya think that you need somebody
Don't ya think that you need someone
Everybody needs somebody
You're not the only one
You're not the only one",rock
217,Guns N' Roses,Civil War,http://genius.com/Guns-n-roses-civil-war-lyrics,"""What we've got here is
Failure to communicate!
Some men you just can't reach!
So, you get what we
Had here last week!
Which is the way he wants it
Well, he gets it
And I don't like it any
More than you men.""


Look at your
Young men fighting
Look at your
Women crying
Look at your
Young men dying
The way they've a
Always done before


Look at the hate
We're breeding
Look at the fear
We're feeding
Look at the lives
We're leading
The way we've
Always done before


My hands are tied
The billions shift
From side to side
And the wars go
On with brainwashed pride
For the love of god
And our human rights
And all these things
Are swept aside
By bloody hands
Time can't deny
And are washed
Away by your genocide
And history hides the
Lies of our civil wars


D'you wear a black armband
When they shot the man
Who said peace
Could last forever
And in my first memories
They shot Kennedy
I went numb when
I learned to see
So I never fell for Vietnam
We got the wall of
D.C. to remind us all
That you can't trust freedom
When it's not in your hands
When everybody's fighting
For their promised land


And I don't need
Your civil war
It feeds the rich while
It buries the poor
Your power hungry
Selling soldiers
In a human grocery store
Isn't that fresh
I don't need your civil war


Look at the shoes
You're filling
Look at the blood
We're spilling
Look at the world
We're killing
The way we've
Always done before
Look in the doubt
We've wallowed
Look at the leaders
We've followed
Look at the lies
We've swallowed
And I don't want
To hear no more


My hands are tied
For all I've seen has
Changed my mind
But still the wars go on
As the years go by
With no love of god
Or human rights
Cause all these dreams
Are swept aside
By bloody hands
Of the hypnotized
Who carry the cross
Of homicide
And history bears the scars
Of our civil wars


We practice selective annihilation
Of mayors and Government officials
For example, we create a vacuum
Then we fill that vacuum
As popular war advances
Peace is closer


I don't need your civil war
It feeds the rich while
It buries the poor
Your power hungry
Selling soldiers
In a human grocery store
Isn't that fresh
And I don't need
Your civil war
I don't need your civil war[x2]
Your power hungry
Selling soldiers
In a human grocery store
Ain't that fresh
I don't need your civil war
I don't need one more war
What's so civil about war anyway?",rock
218,Guns N' Roses,Sweet Child O' Mine prod. by Mike Clink,http://genius.com/Guns-n-roses-sweet-child-o-mine-lyrics,"She's got a smile that it seems to me
Reminds me of childhood memories
Where everything was as fresh as the bright blue sky
Now and then when I see her face
She takes me away to that special place
And if I'd stare too long
I'd probably break down and cry


Sweet child o' mine
Sweet love of mine


She's got eyes of the bluest skies
As if they thought of rain
I hate to look into those eyes
And see an ounce of pain
Her hair reminds me of a warm safe place
Where as a child I'd hide
And pray for the thunder
And the rain
To quietly pass me by





[Outro]
Where do we go
Where do we go now
Where do we go
Sweet child o' mine",rock
219,Guns N' Roses,Welcome To The Jungle prod. by Mike Clink,http://genius.com/Guns-n-roses-welcome-to-the-jungle-lyrics,"Welcome to the jungle, we got fun and games
We got everything you want, honey we know the names
We are the people that can find, whatever you may need
If you got the money honey, we got your disease


In the jungle, welcome to the jungle
Watch it bring you to your shun n-n-n-n-n-n-n-n knees, knees
I wanna watch you bleed


Welcome to the jungle, we take it day by day
If you want it you're going to bleed, but it's the price you pay
And you're a very sexy girl, very hard to please
You can taste the bright lights, but you won't get there for free
In the jungle, welcome to the jungle
Feel my, my, my serpentine, I want to hear you scream




Welcome to the jungle, it gets worse here everyday
You learn to live like an animal, in the jungle where we play
If you got a hunger for what you see, you'll take it eventually
You can have anything you want, but you better not take it from me




And when you're high you never
Ever want to come down
So down, so down, so down yeah

[GuitarSolo]


You know where you are, you're in the jungle baby
You're going to die, in the jungle


Welcome to the jungle, watch it bring you to your knees, knees
In the jungle, welcome to the jungle
Feel my, my, my serpentine
In the jungle, welcome to the jungle
Watch it bring you to your knees, knees
In the jungle, welcome to the jungle
Watch it bring you to your, it's going to bring you down",rock
220,Guns N' Roses,Don't Cry,http://genius.com/Guns-n-roses-dont-cry-lyrics,"Talk to me softly
There's something in your eyes
Don't hang your head in sorrow
And please don't cry
I know how you feel inside, I've-
I've been there before
Something is changing inside you
And don't you know


Don't you cry tonight
I still love you, baby
Don't you cry tonight
Don't you cry tonight
There's a heaven above you, baby
And don't you cry tonight


Give me a whisper
And give me a sigh
Give me a kiss before you
Tell me goodbye
Don't you take it so hard now
And please don't take it so bad
I'll still be thinking of you
And the times we had, baby


Don't you cry tonight
Don't you cry tonight
Don't you cry tonight
There's a heaven above you, baby
And don't you cry tonight


And please remember
That I never lied
And please remember
How I felt inside now, honey
You got to make it your own way
But you'll be alright now, sugar
You'll feel better tomorrow
Come the morning light now, baby


And don't you cry tonight
Don't you cry tonight
Don't you cry tonight
There's a heaven above you, baby
And don't you cry
Don't you ever cry
Don't you cry tonight
Baby maybe someday
Don't you cry
Don't you ever cry
Don't you cry tonight",rock
